id,path,caption
190,D:\Sem1_25-26\Thesis\source\dataset_animals\subset\subset_100\dog_two_dogs_playing_together_11.jpg,two small dogs walking on a leash
191,D:\Sem1_25-26\Thesis\source\dataset_animals\subset\subset_100\dog_two_dogs_playing_together_12.jpg,two dogs playing in the sand
192,D:\Sem1_25-26\Thesis\source\dataset_animals\subset\subset_100\dog_two_dogs_playing_together_17.jpg,a dog and a dog playing in the grass
193,D:\Sem1_25-26\Thesis\source\dataset_animals\subset\subset_100\dog_two_dogs_playing_together_18.jpg,a dog is laying in the grass in a field
194,D:\Sem1_25-26\Thesis\source\dataset_animals\subset\subset_100\dog_two_dogs_playing_together_3.jpg,a dog walking on a sidewalk next to a building
195,D:\Sem1_25-26\Thesis\source\dataset_animals\subset\subset_100\dog_two_dogs_playing_together_4.jpg,two dogs playing in the snow
196,D:\Sem1_25-26\Thesis\source\dataset_animals\subset\subset_100\dog_two_dogs_playing_together_5.jpg,two dogs playing in the snow
197,D:\Sem1_25-26\Thesis\source\dataset_animals\subset\subset_100\dog_two_dogs_playing_together_6.jpg,two dogs running in a grassy field
198,D:\Sem1_25-26\Thesis\source\dataset_animals\subset\subset_100\dog_two_dogs_playing_together_7.jpg,two dogs playing with a stuffed animal toy
199,D:\Sem1_25-26\Thesis\source\dataset_animals\subset\subset_100\dog_two_dogs_playing_together_9.jpg,a dog and a dog are playing with a fr fr fr fr fr fr fr fr fr fr fr fr fr fr fr fr fr fr fr fr fr fr fr fr fr fr fr fr fr fr fr fr fr fr fr fr fr fr fr fr
